{
  "$schema": "https://json-schema.org/draft/2020-12/schema",
  "title": "nv-curate datasources.json",
  "description": "Site/datasource-specific curation plan consumed by nv-curate. Produced by `--action plan` and consumed by `--action curate|finetune`.",
  "type": "object",
  "required": ["name", "raw_data", "pipeline"],
  "properties": {
    "name": {"type": "string", "description": "Datasource identifier (e.g. 'mrbrain')."},
    "site": {"type": "string", "description": "Optional site identifier."},
    "raw_data": {
      "type": "object",
      "required": ["path"],
      "properties": {
        "path": {"type": "string", "description": "Directory holding raw report CSVs (and optionally image volumes). Relative paths resolve against the datasources.json location."},
        "reports_glob": {"type": "string", "default": "*_reports*.csv"},
        "images_glob": {"type": "string", "default": "**/*.nii.gz"}
      }
    },
    "target": {
      "type": "object",
      "description": "Where the AI-ready dataset is written. Omit `path` to write under the run --out directory.",
      "properties": {
        "path": {"type": ["string", "null"]},
        "ai_ready": {"type": "boolean"}
      }
    },
    "pipeline": {
      "type": "object",
      "properties": {
        "steps": {
          "type": "array",
          "items": {"type": "string", "enum": ["anonymize", "translate", "structure", "classify"]},
          "description": "Ordered subset of the transform stages to run."
        },
        "mode": {"type": "string", "enum": ["mock", "live"]},
        "model": {"type": "string", "description": "HF model id used by all live LLM stages."},
        "id_col": {"type": "string", "default": "UID"},
        "text_col": {"type": "string", "default": "report"}
      }
    },
    "task": {
      "type": "object",
      "description": "Downstream AI task the curated dataset feeds.",
      "properties": {
        "type": {"type": "string", "enum": ["analysis", "finetune"]},
        "model": {"type": "string", "description": "Target model, e.g. 'nv-generate-mr-brain'."},
        "modality": {"type": "string", "description": "Image modality for the finetune datalist, e.g. 'mri_t1'."}
      }
    },
    "join_key": {"type": "string", "default": "study_uid", "description": "Key used to join the report track to the image track."}
  },
  "additionalProperties": true
}
