{
  "name": "fixture-MR-0002",
  "site": "synthetic-demo",
  "raw_data": {
    "path": "raw_data",
    "reports_glob": "MR-0002_report.csv",
    "images_glob": "**/*.nii.gz"
  },
  "target": {
    "ai_ready": true
  },
  "pipeline": {
    "steps": [
      "anonymize",
      "translate",
      "structure",
      "classify"
    ],
    "mode": "mock",
    "id_col": "UID",
    "text_col": "report"
  },
  "join_key": "study_uid"
}
